{
  "$schema": "../schema/exam.schema.json",
  "id": "exam2",
  "title": "Practice Exam #2 — CCAR-F (60 items, 120 minutes)",
  "time_limit_minutes": 120,
  "domains": [
    {
      "id": "D1",
      "name": "Agentic Architecture & Orchestration"
    },
    {
      "id": "D2",
      "name": "Tool Design & MCP Integration"
    },
    {
      "id": "D3",
      "name": "Claude Code Configuration & Workflows"
    },
    {
      "id": "D4",
      "name": "Prompt Engineering & Structured Output"
    },
    {
      "id": "D5",
      "name": "Context Management & Reliability"
    },
    {
      "id": "Misc",
      "name": "Miscellaneous / Scope"
    }
  ],
  "questions": [
    {
      "number": 1,
      "scenario": "Scenario E — Developer Productivity with Claude (Q1–12)",
      "domain": "D2",
      "select": 1,
      "text": "You want to onboard engineers to an unfamiliar legacy codebase with Claude. Which built-in tool finds all imports of a deprecated module across the codebase?",
      "options": [
        {
          "key": "A",
          "text": "Glob `**/*`"
        },
        {
          "key": "B",
          "text": "Grep for the module name"
        },
        {
          "key": "C",
          "text": "Read all files"
        },
        {
          "key": "D",
          "text": "Bash `ls -R`"
        }
      ],
      "answer": [
        "B"
      ],
      "why": "Grep finds content; module imports are content patterns."
    },
    {
      "number": 2,
      "scenario": "Scenario E — Developer Productivity with Claude (Q1–12)",
      "domain": "D2",
      "select": 1,
      "text": "An Edit operation fails repeatedly — the target code string appears in many files. The reliable fix?",
      "options": [
        {
          "key": "A",
          "text": "Retry Edit at higher precision."
        },
        {
          "key": "B",
          "text": "Use Read to load the full file, then Write the corrected content."
        },
        {
          "key": "C",
          "text": "Use Glob to find unique lines."
        },
        {
          "key": "D",
          "text": "Restart Claude Code."
        }
      ],
      "answer": [
        "B"
      ],
      "why": "Read + Write fallback for non-unique Edit text."
    },
    {
      "number": 3,
      "scenario": "Scenario E — Developer Productivity with Claude (Q1–12)",
      "domain": "D2",
      "select": 1,
      "text": "Recommended order to build a mental model of a new codebase?",
      "options": [
        {
          "key": "A",
          "text": "Read every file once."
        },
        {
          "key": "B",
          "text": "Start with Grep for entry points, then Read to trace imports and flows — incrementally."
        },
        {
          "key": "C",
          "text": "Glob all files, then Write notes."
        },
        {
          "key": "D",
          "text": "Use Bash to grep and never use Read."
        }
      ],
      "answer": [
        "B"
      ],
      "why": "Incremental: Grep entry points → Read imports."
    },
    {
      "number": 4,
      "scenario": "Scenario E — Developer Productivity with Claude (Q1–12)",
      "domain": "D2",
      "select": 1,
      "text": "You trace usage of an exported function across wrapper modules. Best approach?",
      "options": [
        {
          "key": "A",
          "text": "Identify all exported names first; then search (Grep) for each name across the codebase."
        },
        {
          "key": "B",
          "text": "Read each file once."
        },
        {
          "key": "C",
          "text": "Use Glob on `*.md`."
        },
        {
          "key": "D",
          "text": "Add console logs everywhere."
        }
      ],
      "answer": [
        "A"
      ],
      "why": "Identify exported names → Grep each across codebase."
    },
    {
      "number": 5,
      "scenario": "Scenario E — Developer Productivity with Claude (Q1–12)",
      "domain": "D2",
      "select": 1,
      "text": "You want Claude to integrate an MCP-based Jira server. Do you prefer a community server or a custom one?",
      "options": [
        {
          "key": "A",
          "text": "Always custom for full control."
        },
        {
          "key": "B",
          "text": "Prefer the existing community MCP server for standard integrations like Jira; reserve custom servers for team-specific workflows."
        },
        {
          "key": "C",
          "text": "Neither — disable MCP."
        },
        {
          "key": "D",
          "text": "Use built-in Grep instead."
        }
      ],
      "answer": [
        "B"
      ],
      "why": "Prefer community MCP for standard integrations; custom only for team-specific."
    },
    {
      "number": 6,
      "scenario": "Scenario E — Developer Productivity with Claude (Q1–12)",
      "domain": "D2",
      "select": 1,
      "text": "The agent keeps preferring built-in `Grep` over your MCP `search_kb` even though `search_kb` is more capable. Root cause / fix?",
      "options": [
        {
          "key": "A",
          "text": "MCP servers must be project-scoped."
        },
        {
          "key": "B",
          "text": "Enhance the MCP tool description to explain capabilities and outputs in detail."
        },
        {
          "key": "C",
          "text": "Disable Grep."
        },
        {
          "key": "D",
          "text": "Use `tool_choice` to force it."
        }
      ],
      "answer": [
        "B"
      ],
      "why": "Enhance MCP tool descriptions so agent prefers them over built-ins."
    },
    {
      "number": 7,
      "scenario": "Scenario E — Developer Productivity with Claude (Q1–12)",
      "domain": "D2",
      "select": 1,
      "text": "Expose a catalog of available documentation/issue summaries so the agent knows what data exists without exploratory calls. Use which MCP primitive?",
      "options": [
        {
          "key": "A",
          "text": "MCP Tools"
        },
        {
          "key": "B",
          "text": "MCP Resources (content catalogs)"
        },
        {
          "key": "C",
          "text": "CLAUDE.md imports"
        },
        {
          "key": "D",
          "text": "Skills"
        }
      ],
      "answer": [
        "B"
      ],
      "why": "MCP Resources expose content catalogs."
    },
    {
      "number": 8,
      "scenario": "Scenario E — Developer Productivity with Claude (Q1–12)",
      "domain": "D2",
      "select": 1,
      "text": "Personal/experimental MCP server you don't want to share via version control. Where?",
      "options": [
        {
          "key": "A",
          "text": "`.mcp.json` at repo root."
        },
        {
          "key": "B",
          "text": "`~/.claude.json` (user-scoped)."
        },
        {
          "key": "C",
          "text": "`CLAUDE.md`."
        },
        {
          "key": "D",
          "text": "`.claude/skills/`."
        }
      ],
      "answer": [
        "B"
      ],
      "why": "`~/.claude.json` user-scoped for personal/experimental."
    },
    {
      "number": 9,
      "scenario": "Scenario E — Developer Productivity with Claude (Q1–12)",
      "domain": "D2",
      "select": 1,
      "text": "You need `${GITHUB_TOKEN}` in `.mcp.json` for credentials without committing the secret. Supported?",
      "options": [
        {
          "key": "A",
          "text": "No — hard-code tokens."
        },
        {
          "key": "B",
          "text": "Yes — `.mcp.json` supports environment variable expansion like `${GITHUB_TOKEN}`."
        },
        {
          "key": "C",
          "text": "Only on Linux."
        },
        {
          "key": "D",
          "text": "Only with a managed policy."
        }
      ],
      "answer": [
        "B"
      ],
      "why": "`${VAR}` env expansion supported in `.mcp.json`."
    },
    {
      "number": 10,
      "scenario": "Scenario E — Developer Productivity with Claude (Q1–12)",
      "domain": "D2",
      "select": 1,
      "text": "Are tools from all configured MCP servers available at once?",
      "options": [
        {
          "key": "A",
          "text": "Only one server at a time."
        },
        {
          "key": "B",
          "text": "Yes — discovered at connection time and available simultaneously."
        },
        {
          "key": "C",
          "text": "Only after `/memory`."
        },
        {
          "key": "D",
          "text": "Only project-scoped servers."
        }
      ],
      "answer": [
        "B"
      ],
      "why": "Tools from all servers available simultaneously at connection."
    },
    {
      "number": 11,
      "scenario": "Scenario E — Developer Productivity with Claude (Q1–12)",
      "domain": "D3",
      "select": 2,
      "text": "Two ways to make a codebase-exploration workflow not pollute the main conversation? (select exactly 2)",
      "options": [
        {
          "key": "A",
          "text": "Use the **Explore** subagent for verbose discovery output."
        },
        {
          "key": "B",
          "text": "Use a skill with **`context: fork`**."
        },
        {
          "key": "C",
          "text": "Add all exploration output to CLAUDE.md."
        },
        {
          "key": "D",
          "text": "Disable `/compact`."
        }
      ],
      "answer": [
        "A",
        "B"
      ],
      "why": "Explore subagent + `context: fork` skill both isolate verbose output."
    },
    {
      "number": 12,
      "scenario": "Scenario E — Developer Productivity with Claude (Q1–12)",
      "domain": "D5",
      "select": 1,
      "text": "Long exploration sessions suffer context degradation. Best recovery design?",
      "options": [
        {
          "key": "A",
          "text": "Each agent exports state to a known location (manifest); coordinator loads manifest on resume and injects into prompts."
        },
        {
          "key": "B",